{
  "schema_version": 1,
  "mode": "paper-chart",
  "type": "radar",
  "title": "模型综合能力评估",
  "subtitle": "六维指标对比",
  "theme": "academic-blue",
  "canvas": {
    "width": 1600,
    "height": 1000
  },
  "data": {
    "source": "paper-chart-radar.csv",
    "sheet": "",
    "row_count": 6,
    "columns": [
      {
        "name": "指标",
        "type": "category",
        "count": 6,
        "missing": 0,
        "unique": 6
      },
      {
        "name": "基线模型",
        "type": "number",
        "count": 6,
        "missing": 0,
        "unique": 6,
        "min": 68,
        "max": 84,
        "mean": 74
      },
      {
        "name": "改进模型",
        "type": "number",
        "count": 6,
        "missing": 0,
        "unique": 6,
        "min": 79,
        "max": 91,
        "mean": 86.66666666666667
      }
    ]
  },
  "encoding": {
    "x": "指标",
    "y": [
      "基线模型",
      "改进模型"
    ],
    "error": "",
    "series": "",
    "x_title": "指标",
    "y_title": "评分"
  },
  "options": {
    "show_grid": true,
    "show_legend": true,
    "y_zero": true,
    "accent": "",
    "note": ""
  }
}
