{
  "schema_version": 1,
  "mode": "paper-chart",
  "type": "errorbar",
  "title": "样本规模对预测性能的影响",
  "subtitle": "均值 ± 标准差",
  "theme": "academic-blue",
  "canvas": {
    "width": 1600,
    "height": 1000
  },
  "data": {
    "source": "paper-chart-errorbar.csv",
    "sheet": "",
    "row_count": 6,
    "columns": [
      {
        "name": "样本规模",
        "type": "number",
        "count": 6,
        "missing": 0,
        "unique": 6,
        "min": 100,
        "max": 1600,
        "mean": 716.6666666666666
      },
      {
        "name": "平均准确率",
        "type": "number",
        "count": 6,
        "missing": 0,
        "unique": 6,
        "min": 0.782,
        "max": 0.899,
        "mean": 0.8553333333333334
      },
      {
        "name": "标准差",
        "type": "number",
        "count": 6,
        "missing": 0,
        "unique": 6,
        "min": 0.009,
        "max": 0.032,
        "mean": 0.01833333333333333
      }
    ]
  },
  "encoding": {
    "x": "样本规模",
    "y": [
      "平均准确率"
    ],
    "error": "标准差",
    "series": "",
    "x_title": "样本规模",
    "y_title": "平均准确率"
  },
  "options": {
    "show_grid": true,
    "show_legend": true,
    "y_zero": false,
    "accent": "",
    "note": ""
  }
}
