{
  "schema_version": 1,
  "mode": "paper-chart",
  "type": "line",
  "title": "算法收敛曲线",
  "subtitle": "样本数 n=6",
  "theme": "academic-blue",
  "canvas": {
    "width": 1600,
    "height": 1000
  },
  "data": {
    "source": "paper-chart-convergence.csv",
    "sheet": "",
    "row_count": 6,
    "columns": [
      {
        "name": "iteration",
        "type": "number",
        "count": 6,
        "missing": 0,
        "unique": 6,
        "min": 1,
        "max": 6,
        "mean": 3.5
      },
      {
        "name": "baseline",
        "type": "number",
        "count": 6,
        "missing": 0,
        "unique": 6,
        "min": 0.35,
        "max": 0.82,
        "mean": 0.5116666666666667
      },
      {
        "name": "improved",
        "type": "number",
        "count": 6,
        "missing": 0,
        "unique": 6,
        "min": 0.19,
        "max": 0.74,
        "mean": 0.38166666666666665
      }
    ]
  },
  "encoding": {
    "x": "iteration",
    "y": [
      "baseline",
      "improved"
    ],
    "error": "",
    "series": "",
    "x_title": "迭代次数",
    "y_title": "目标函数值"
  },
  "options": {
    "show_grid": true,
    "show_legend": true,
    "y_zero": false,
    "accent": "",
    "note": ""
  }
}
